<,IssueID,URL,Title,Status,CreatedAt,BugType ,StackLayer,,CTClass,subtype,reason Bug,reason Stack,reason Class
NVIDIA/cuda-quantum,1925,https://github.com/NVIDIA/cuda-quantum/issues/1925,[CI] [tensornet] Attempt to set target causes fatal error in some OS environments,open,2024-07-12T23:03:00Z,Backend-/Framework-Integrations-Bug,Framework-Integration,C,C,,Test that runs through all targets with parameters causes CI runs to crash if optional simulators are not correctly available/integrated.,"The problem lies in the interaction between the test infrastructure, set_target, and optional backends in different OS/CI environments.",This is about robust implementation of target detection/error handling in code and CI; this cannot be prevented in a meaningful way by additional compile-time analyses of user kernels.
NVIDIA/cuda-quantum,1924,https://github.com/NVIDIA/cuda-quantum/issues/1924,[Python] Remote execution speed up doesn't support custom operations,open,2024-07-12T21:51:44Z,Backend-/Framework-Integrations-Bug,Framework-Integration,C,C,,"Local registration of custom_h works, but the remote server reports ""known kernels are []"" and cannot execute the kernel.",The error lies in the integration between the Python front end/custom op registry and the remote execution service.,Whether custom operations are correctly transported/registered to the remote backend is an integration issue and cannot be detected by static analysis of the user code.
NVIDIA/cuda-quantum,1909,https://github.com/NVIDIA/cuda-quantum/issues/1909,cudaq.observe causes a memory leak,closed,2024-07-10T05:34:33Z,Performance-/Numerik-Bug,Runtime-/Framework-Runtime ,C,C,,Memory usage increases continuously with many observe calls and is not released.,"The problem lies in the resource/memory management of the runtime/execution engine, not in the compiler or API semantics",Memory leaks of this type are classic runtime implementation bugs and cannot be prevented by compile-time analyses of the user program.
NVIDIA/cuda-quantum,1895,https://github.com/NVIDIA/cuda-quantum/issues/1895,Endian is inconsistent between State and SpinOperator.to_matrix,closed,2024-07-08T07:26:25Z,Performance-/Numerik-Bug,Backend-Library ,C,C,,Expected value from observe and direct calculation state @ to_matrix() @ state deliver different results due to different endianness conventions.,The error lies in the implementation of SpinOperator.to_matrix or the assignment of the operator to the state basis.,Inconsistent endianness is a design/implementation error in the library and cannot be avoided by static analysis of user kernels.
NVIDIA/cuda-quantum,1894,https://github.com/NVIDIA/cuda-quantum/issues/1894,Controlled exp_pauli is not correct,closed,2024-07-08T07:08:46Z,Performance-/Numerik-Bug ,Backend-Library ,C,C,,"Applying cudaq.control(...) to a unitary that uses exp_pauli(...) produces an incorrect state (the Hadamard-test example does not yield the expected Bell state amplitudes), while an equivalent construction using a simple gate (e.g., X) behaves correctly.","The defect is in the backend/library implementation of controlled exp_pauli (i.e., how the controlled version of the exp_pauli operation is constructed/lowered), not in user code syntax or environment setup.",This is a semantic/numerical backend correctness bug: it requires fixing the implementation of the controlled exp_pauli path and cannot be prevented by generic compile-time or user-side static checks.
NVIDIA/cuda-quantum,1875,https://github.com/NVIDIA/cuda-quantum/issues/1875,issue with if condition after mid circuit measurement,closed,2024-07-01T15:17:07Z,API-/Usage-/Logic-Bug (High-Level),Backend-Library,C,C,,Semantically equivalent control logic with and and nested if statements leads to different behavior; a is not set in the second case.,"The cause is the code generation/lowering logic for Boolean expressions and measurement results, not the environment or backend selection."," This is a compiler/IR lowering bug; additional static checks on the user kernel would not prevent it, only implementation fixes in the codegen."
NVIDIA/cuda-quantum,1874,https://github.com/NVIDIA/cuda-quantum/issues/1874,Execution hangs on OpenSUSE when installed via installer,closed,2024-07-01T13:16:37Z,Performance-/Numerik-Bug,Runtime-/Framework-Runtime ,C,C,,Execution on GPU backends under OpenSUSE is blocked or only continues after a timeout.,The problem lies in the interaction between CUDA-Q runtime and libc++/OS-specific environment when starting/executing GPU backends.,OS/runtime-specific hangers of this type are implementation/configuration details of the runtime and cannot be avoided by additional compile-time analyses of the user code.
NVIDIA/cuda-quantum,1871,https://github.com/NVIDIA/cuda-quantum/issues/1871,Calling the same quantum kernel in cudaq.control and cudaq.adjoint in the main kernel give error.,closed,2024-06-30T13:35:07Z,API-/Usage-/Logic-Bug (High-Level),Framework-Integration ,C,C,,A valid pattern (calling the same kernel via cudaq.control and cudaq.adjoint inside a parent kernel) fails with an internal error like “does not reference a valid function.” ,"The root cause is in MLIR/codegen handling of controlled/adjointed function symbols, not in Python usage or the environment. ",This is a compiler/codegen integration issue; user-side compile-time checks cannot meaningfully prevent it 
NVIDIA/cuda-quantum,1860,https://github.com/NVIDIA/cuda-quantum/issues/1860,Build dependency missing for python?,closed,2024-06-27T20:45:25Z,Build-/Install-/Packaging-Bug,Build/Deploy/Environment ,B ,B ,B1,suspect that there may be missing boilerplate regarding copying the .py files in our cmake recipes. ,This is a build / environment configuration issue in the CUDA-Q installation flow ,"A simple configure-time check in CMake could fix this problem, so B1"
NVIDIA/cuda-quantum,1813,https://github.com/NVIDIA/cuda-quantum/issues/1813,DepolarizationChannel not completely depolarizing,closed,2024-06-13T16:47:35Z,Performance-/Numerik-Bug,Backend-Library,C,C,,Depolarizing channel with error probability 1 generates <Z> expectation values that depend on the rotation angle instead of being 0.,"The error lies in the implementation of DepolarizationChannel or density-matrix-cpu, not in the high-level API.",Incorrect channel semantics is purely an implementation/numerical bug in the simulator and cannot be prevented by type/contract checks in the user code.
NVIDIA/cuda-quantum,1809,https://github.com/NVIDIA/cuda-quantum/issues/1809,Kernels do not take as input a list[list[int]] type object,open,2024-06-13T15:57:42Z,API-/Usage-/Logic-Bug (High-Level) ,High-Level-API / Framework-Logic ,A,A,,"Passing a nested Python container list[list[int]] into a @cudaq.kernel fails at runtime with Cannot infer CUDA-Q type from provided Python type (!cc.stdvec<!cc.stdvec>), even though the docs show examples that suggest this should work.",The issue is in the Python front-end / type-mapping layer that infers CUDA-Q types from Python annotations and values; it cannot correctly lower nested list containers into the expected CUDA-Q/CC-IR vector-of-vector type. ,This is a compile-time/pre-execution preventable API/type-support issue: a front-end validator or static type check could deterministically reject unsupported nested containers (or support them) before execution. Fits Class A
NVIDIA/cuda-quantum,1804,https://github.com/NVIDIA/cuda-quantum/issues/1804,[python] Combining `cudaq` module with `multiprocesssing` module can result in deadlock,closed,2024-06-12T14:30:28Z,Config-/Environment-Bug,Runtime-/Framework-Runtime ,C,C,,Using the default fork startup method with a multithreaded CUDA-Q process leads to deadlock.,"The problem arises in the runtime interaction between the Python process start method and CUDA-Q runtime, not in the build or kernel code.","Fork-vs-Spawn-Probleme bei Multithreading sind typische Runtime-/Systemeffekte, die nicht sinnvoll durch statische Analyse des User-Programms verhindert werden k�nnen."
NVIDIA/cuda-quantum,1799,https://github.com/NVIDIA/cuda-quantum/issues/1799,Incorrect circuit compilation when using some nested loops,closed,2024-06-11T11:24:06Z,API-/Usage-/Logic-Bug (High-Level),Backend-Library,C,C,,"Decorator path compiles nested loops with for k in range(j+1, N) into a logically incorrect circuit.","The cause is an LLVM/MLIR codegen/loop normalization bug in the compiler pipeline, not in the Python frontend or environment.","(not reasonably avoidable at compile time). Miscompilation due to upstream loop passes can practically only be fixed by fixes/mitigations in the compiler, not by additional type/contract checks on user code."
NVIDIA/cuda-quantum,1784,https://github.com/NVIDIA/cuda-quantum/issues/1784,Quake.ExpPauliOp is incomplete,open,2024-06-10T15:34:46Z,API-/Usage-/Logic-Bug (High-Level),High-Level-API / Framework-Logic ,C,C,,The ExpPauliOp class does not behave like a clean value type API during copy/move/assignment. This is an object/API semantic bug. ,"ExpPauliOp is part of the high-level operator API; its implementation is affected, not the backend or environment. ","Incorrect value semantics in a library class cannot be prevented by analyzing the user code, but only by correcting the class implementation. "
NVIDIA/cuda-quantum,1749,https://github.com/NVIDIA/cuda-quantum/issues/1749,`do { ... } while (false)` causes infinite loop when `--enable-mlir` is set,closed,2024-06-03T16:04:49Z,API-/Usage-/Logic-Bug (High-Level) ,Backend-Library ,C ,C ,,Using the common macro pattern do { ... } while (0) inside a __qpu__ kernel causes programs compiled with nvq++ --enable-mlir to hang at runtime,"Issue seems to be in the MLIR-based compilation / backend path of CUDA-Q. the kernel is valid C++ code, but only the MLIR-enabled pipeline produces IR that leads to an apparent infinite loop during execution ",Whether this specific do { ... } while (0) pattern is lowered correctly depends on internal MLIR control-flow handling. Generic frontend type checker on code would not catch this
NVIDIA/cuda-quantum,1726,https://github.com/NVIDIA/cuda-quantum/issues/1726,Cannot call C++ __qpu__ function from within another kernel if parameters contain vector of cudaq::measure_results,closed,2024-05-29T16:53:45Z,API-/Usage-/Logic-Bug (High-Level),Framework-Integration,B ,B ,B2,"Valid C++ code (xor_result with measure_result vector), but MLIR inlining pass incorrectly flags ""recursion.""",The problem lies in aggressive early inlining pass + type IR mapping between C++ and MLIR.,"A call graph analyzer could distinguish between genuine and false recursion, but this requires advanced data flow analysis."
NVIDIA/cuda-quantum,1703,https://github.com/NVIDIA/cuda-quantum/issues/1703,Segfault during circuit simulation with 2^19 controlled rotation gates,closed,2024-05-22T16:18:59Z,Performance-/Numerik-Bug,Runtime-/Framework-Runtime ,C,C,,"The problem only occurs with a very large number of cr1/crx gates (loop with 2**19 iterations) and manifests itself as a segfault across multiple targets - typical for a resource/performance bug (e.g., stack/heap exhaustion, IR too large, etc.), not for pure API or configuration issues.","Since the behavior is cross-target and tied to MLIR enablement, it points to a bug in generic runtime/JIT/IR handling (e.g., scheduling, memory management), not in a specific backend library.","Whether a specific circuit size leads to a segfault depends on internal data structures, JIT strategies, and resource limits; this cannot be verified purely statically, but is rather a question of implementation/runtime."
NVIDIA/cuda-quantum,1682,https://github.com/NVIDIA/cuda-quantum/issues/1682,break within two loops is not handled right.,closed,2024-05-15T12:45:44Z,API-/Usage-/Logic-Bug (High-Level),High-Level-API / Framework-Logic ,C,C,,"The user employs valid language constructs (while loop, measurement, if res: break); however, the compiler produces an incorrect IR (arity mismatch of cc.unwind_break) - this is a frontend/control flow lowering bug.",This affects the logic that translates Python kernels with classical control and quantum measurement into a consistent IR; backend and env are secondary.,"The implementation of control flow lowering is broken here; additional static checks on the user code would not prevent the bug (the compiler should support this pattern), more robust pass implementation/verification is needed."
NVIDIA/cuda-quantum,1670,https://github.com/NVIDIA/cuda-quantum/issues/1670,[c++] qvector initialization from vector of doubles fails for f32 simulator,closed,2024-05-13T20:07:46Z,API-/Usage-/Logic-Bug (High-Level),High-Level-API / Framework-Logic ,A,A,,"Semantically correct user code (double vector as init state), but the API/kernel logic does not automatically accept type conversion (FP64?FP32), even though the codebook provides for it.","The problem lies in the Qvector constructor semantics and their error handling, not in the backend library or environment.",Static type checking could detect precision mismatch directly when the constructor is called; better overloads or type constraints would catch the error at compile time.
NVIDIA/cuda-quantum,1663,https://github.com/NVIDIA/cuda-quantum/issues/1663,Python version on Quantum Cloud does not allow exponentiation operator,closed,2024-05-11T03:30:04Z,Backend-/Framework-Integrations-Bug,Framework-Integration,B ,B ,B1,"The code runs locally, but legalizing math.ipowi fails on the remote target; this is a problem in the integration of Python/IR lowering with the passes/constraints of the cloud backend.",This affects the layer that connects the Python kernel + IR pass pipeline to the remote backend (nvqc); multiple targets share the same frontend/pass logic.," One could imagine a (domain-specific) static compatibility analysis that checks in advance whether all ops (** ? ipowi) used are legalizable for a given target/pass pipeline set, and if not, provides a clear compile-time error message early on; This is advanced, but conceptually possible."
NVIDIA/cuda-quantum,1662,https://github.com/NVIDIA/cuda-quantum/issues/1662,Subtraction of variables gives unhandled BinOp.Sub error within a python kernel,closed,2024-05-10T21:46:43Z,API-/Usage-/Logic-Bug (High-Level),High-Level-API / Framework-Logic ,C,C,,"A syntactically completely harmless expression in the Python kernel fails, while an equivalent rewritten form works. This suggests incomplete/flawed high-level lowering/AST bridging logic."," The error occurs when translating the Python AST into the internal IR (kernel front end), not in the backend or in the environment."," Whether a particular AST pattern is supported in the compiler is an implementation issue; this cannot be prevented by additional analysis of the user code, but only by more robust implementation/testing of the front end."
NVIDIA/cuda-quantum,1620,https://github.com/NVIDIA/cuda-quantum/issues/1620,[Python Kernel] `bool` to `int` type casting issue,closed,2024-05-07T03:41:09Z,API-/Usage-/Logic-Bug (High-Level) ,Backend-Library ,B ,B ,B2,"A measurement result bit = mz(aux) is lowered to IR that sign-extends the i1 value to i64 (sext i1 %7 to i64) and then compares it to 1. Since true becomes -1 under signed extension, the icmp eq i64 %8, 1 condition is never satisfied, so the if bit == 1: branch is logically wrong","The defect is in the kernel codegen. The high-level kernel code is valid, but the generated IR compearision ins obviously incorrect. ",A specialised IR validator or formal check over the codegen pipeline could detect inconsistent patterns like sext i1 followed by comparison with 1 for a logical boolean. and enforce zero-extension or correct comparison 
NVIDIA/cuda-quantum,1618,https://github.com/NVIDIA/cuda-quantum/issues/1618,`MidCircuitMeasurementAnalyzer` doesn't handle all cases of measurement assigned variables ,closed,2024-05-07T01:02:31Z,API-/Usage-/Logic-Bug (High-Level),High-Level-API / Framework-Logic ,C,C,,Certain types of conditions are not handled correctly in the Analysis Helper. Llogic/oversight bug in the high-level analysis tool.,"It affects the internal analysis/frontend logic (AST/IR bridging), not build, backend, or runtime.",The vulnerability lies in the helper function itself; user code analysis cannot prevent this as long as the helper is not fully implemented.
NVIDIA/cuda-quantum,1571,https://github.com/NVIDIA/cuda-quantum/issues/1571,make check-targets doesn't have all dependencies in the CMakeLists.txt files,open,2024-04-25T23:00:55Z,Build-/Install-/Packaging-Bug,Build/Deploy/Environment,B ,B ,B1,"The build/install logic does not correctly update runtime libraries when switching branches, resulting in link/runtime errors.",The problem occurs in the build/CI/install environment before anything is simulated or compiled.,"A precisely modeled build graph or tooling that forces dependent targets to rebuild when branches change could detect such errors, but this is a more complex build/analysis task."
NVIDIA/cuda-quantum,1566,https://github.com/NVIDIA/cuda-quantum/issues/1566,Cannot pass a list of Pauli words to `observe_async`,closed,2024-04-25T14:24:56Z,API-/Usage-/Logic-Bug (High-Level),High-Level-API / Framework-Logic ,C,C,,"Synchronous observe accepts a list of Pauli strings, whereas observe_async does not. Inconsistent API/contract logic.","The error lies in the Python bindings or the high-level API (overloads/conversions), not in simulation, build, or environment.","This is a gap in the implementation of the async overload; additional analysis of the user code does not prevent this, a library fix is required."
NVIDIA/cuda-quantum,1539,https://github.com/NVIDIA/cuda-quantum/issues/1539,ChemistryTester bug when nvidia target is available,closed,2024-04-18T12:37:56Z,Backend-/Framework-Integrations-Bug,Framework-Integration,C,C,,"The Python/PySCF bindings initialize CUDA-Q and set the default target to nvidia, while the tester is linked to QPP FP64 - integration/target selection conflict.","The problem lies in the interaction between the Python helper library, target management, and C++ tester (mix of different backends in one pipeline).",Global target switches and precision mismatches caused by such integration paths are runtime/configuration details that cannot realistically be verified by static analysis of the Quantum user code.
NVIDIA/cuda-quantum,1529,https://github.com/NVIDIA/cuda-quantum/issues/1529,Calling kernel functions with list parameters gives incorrect results,closed,2024-04-17T17:05:02Z,API-/Usage-/Logic-Bug (High-Level),High-Level-API / Framework-Logic ,C,C,,"The kernel test_param(i: int, v1: list[int]) -> int should return i each time, but returns 42 four times. Logic/binding bug in the Python kernel call implementation.","The error lies in the way Python call sites/arguments are mapped in IR/Runtime, i.e., in the high-level language/framework layer.",Incorrect capturing/assignment of arguments is an internal binding/runtime problem that cannot be prevented by additional type or CT analyses of the user code.
NVIDIA/cuda-quantum,1498,https://github.com/NVIDIA/cuda-quantum/issues/1498,Output discrepancy when args of mz are in a list vs when comma separated ,closed,2024-04-11T06:39:51Z,API-/Usage-/Logic-Bug (High-Level),High-Level-API / Framework-Logic ,C,C,,"The measurement API behaves inconsistently: qubits passed as a list return the correct bit length, but comma-separated arguments do not. API/semantics bug.","This concerns the Python frontend/measurement API and its result format, not the backend.",The incorrect argument handling is a library implementation problem; CT analyses of the user code would not change anything.
NVIDIA/cuda-quantum,1469,https://github.com/NVIDIA/cuda-quantum/issues/1469,Cannot run Python range-based for loops through the synthesizer (affects NVQC),closed,2024-04-02T23:58:05Z,API-/Usage-/Logic-Bug (High-Level),High-Level-API / Framework-Logic ,C,C,,"The standard Python pattern (for i in range(len(parms)): parms[i]) leads to an internal IR/pass error, while the variant for i in parms works.  Frontend/IR generation bug.","The problem arises in Python kernel MLIR generation and subsequent lowering, not in the simulator or build.",The incorrect handling of constant arrays and cc.get_const_element in LowerToQIR is an internal pass weakness that cannot be compensated for by analyzing the user code.
NVIDIA/cuda-quantum,1464,https://github.com/NVIDIA/cuda-quantum/issues/1464,`cnot` operation is not compiled properly in MLIR mode,closed,2024-04-02T02:46:37Z,API-/Usage-/Logic-Bug (High-Level),High-Level-API / Framework-Logic ,C,C,,The shorthand cnot violates its semantics when MLIR is enabled because it is translated into two single-X gates instead of a controlled operation- Asemantics/compiler logic bug.,The incorrect translation occurs in the frontend/MLIR lowering of the kernel code before a specific backend comes into play.,"An incorrectly implemented lowering of the operator can only be fixed by fixing/verifying the compiler, not by adding additional checks to the user kernel."
NVIDIA/cuda-quantum,1432,https://github.com/NVIDIA/cuda-quantum/issues/1432,Handle references to constant data in `GenerateDeviceCodeLoader`,closed,2024-03-22T02:29:15Z,API-/Usage-/Logic-Bug (High-Level),Framework-Integration,C,C,,The design/implementation logic of module excision relies solely on the call graph and overlooks constantly referenced data. Maybe is a conceptual logic error in the compiler pipeline.,"This affects the interaction between the kernel module, host code, and compiler IR when extracting the kernel module, i.e., the integration/compiler layer.","Here, the analysis itself (call graph only) is insufficient; additional CT checks on the user code do not change anything as long as the excision algorithm does not include constant data."
NVIDIA/cuda-quantum,1431,https://github.com/NVIDIA/cuda-quantum/issues/1431,Endian representation bug in `QppCircuitSimulator::observe`,open,2024-03-22T02:25:40Z,Backend-/Framework-Integrations-Bug,Backend-Library,C,C,,The change in qpp state vector endianness was not consistently applied in QppCircuitSimulator::observe with Hamiltonian matrix generation (spin_op::to_matrix) - integration error between two backend components.,"The bug is entirely in the qpp backend implementation (state vector layout vs. Hamiltonian matrix), not in the high-level framework.",Whether Matrix and Statevector use the same endianness is an internal backend detail that cannot be verified by analyzing the user code.
NVIDIA/cuda-quantum,1421,https://github.com/NVIDIA/cuda-quantum/issues/1421,LLVM aarch64 relocation overflow,closed,2024-03-20T03:55:38Z,Performance-/Numerik-Bug,Runtime-/Framework-Runtime,C,C,,"In memory-intensive VQEs, a relocation assertion fails deep within the LLVM JIT. Resource/numerical/JIT bug, not a simple API error.","The crash occurs in the execution/JIT runtime (RuntimeDyldELF), i.e., in the runtime layer above the backend.","Such size/overflow problems in JIT/relocations cannot be avoided by type or CT analyses of the user code, but require more robust runtime implementation."
NVIDIA/cuda-quantum,1400,https://github.com/NVIDIA/cuda-quantum/issues/1400,Circuit drawer retains qubits from previously printed kernel(s),closed,2024-03-14T17:22:45Z,API-/Usage-/Logic-Bug (High-Level),High-Level-API / Framework-Logic ,C,C,,Drawing the same kernel leads to increasingly longer circuit diagrams due to stale global state. A logic/state bug in the Draw API.,"Affects the visualization/front-end layer (cudaq.draw), without involving the simulator or environment.","A mismanaged global state in the draw code can only be fixed by correcting the implementation, not by analyzing the user kernel."
NVIDIA/cuda-quantum,1396,https://github.com/NVIDIA/cuda-quantum/issues/1396,Batched measurement outputs dont allign to expected results ,closed,2024-03-14T14:50:03Z,API-/Usage-/Logic-Bug (High-Level),High-Level-API / Framework-Logic ,C,C,,The behavior of cudaq.observe with multiple Hamiltonian terms is inconsistent with the physically expected semantics for independent qubits - logic/semantics bug in the Observe API.,"The problem lies in the way the high-level observe routine aggregates results for lists of terms, not in the backend or build.","The error lies in the internal implementation of the observe logic; additional compile-time checks on the user code could not prevent this, a library fix is required."
NVIDIA/cuda-quantum,1374,https://github.com/NVIDIA/cuda-quantum/issues/1374,nvqpp_SampleAsync fails on machines with multiple GPUs,closed,2024-03-12T16:04:15Z,Backend-/Framework-Integrations-Bug ,Runtime-/Framework-Runtime ,C,C,,"The official Async Sample CTest crashes with double-free/heap corruption when using multi-GPU/MQPU. An integration/runtime bug (MQPU, allocator, async scheduling), not purely a performance bug. ","The error occurs in the running test binary in heap/runtime management, not in the build or high-level frontend. ",Double-free/heap corruption errors in internal runtime/allocator code are classic implementation problems; they cannot be avoided by compile-time analysis of user code. 
NVIDIA/cuda-quantum,1367,https://github.com/NVIDIA/cuda-quantum/issues/1367,Synthesizer produces error when mixing certain argument types,closed,2024-03-11T15:54:51Z,Performance-/Numerik-Bug ,Framework-Integration ,C,C,,"A synthesis process for a kernel leads to std::bad_alloc, apparently because an incorrect offset causes a structure that is much too large to be interpreted/allocated ? resource/index/numerical error. ","The error lies in the interaction between argument layout and synthesizer logic (host data IR/Runtime), i.e., in the compiler/synthesizer integration layer. ",An incorrectly calculated offset in the synthesizer is an implementation bug; it does not make sense to prevent this through static analysis of user programs. 
