<,IssueID,URL,Title,Status,CreatedAt,BugType ,StackLayer,,CTClass,subtype,reason Bug,reason Stack,reason Class
NVIDIA/cuda-quantum,1257,https://github.com/NVIDIA/cuda-quantum/issues/1257,Duplicate quake code in `cudaq::get_quake_by_name` if inlining is disabled,closed,2024-02-20T01:48:47Z,API-/Usage-/Logic-Bug (High-Level) ,Framework-Integration ,C,C,,"A kernel that calls another twice should result in a clean module structure; instead, the callee function is defined twice. A code/logic bug. ","The double definition arises in MLIR/Quake code generation, i.e., in the integration of __qpu__ front ends with the IR/compiler infrastructure. ",This is an internal error in the code generator; additional analysis of the user code will not change anything as long as the generator is implemented incorrectly. 
NVIDIA/cuda-quantum,1218,https://github.com/NVIDIA/cuda-quantum/issues/1218,Out of scope kernel ,closed,2024-02-13T09:40:16Z,API-/Usage-/Logic-Bug (High-Level) ,Runtime-/Framework-Runtime ,C,C,,The user creates a kernel in a function and returns it. A completely legitimate pattern. the fact that this particular syntax leads to a segfault on nvidia-mqpu indicates a bug in the kernel lifetime/binding logic. ,"The crash occurs in the Async/MQPU runtime during execution, not during frontend lowering.",Object lifetimes and memory management in runtime/binding code are internal implementation details; compile-time analyses of user code are of no help here.
NVIDIA/cuda-quantum,1215,https://github.com/NVIDIA/cuda-quantum/issues/1215,`cudaq::adjoint` not handling double adjoint.,closed,2024-02-12T22:28:33Z,API-/Usage-/Logic-Bug (High-Level) ,High-Level-API / Framework-Logic ,C,C,,A combination of rz<adj> in the kernel and adjoint(foo) effectively results in two adjoint rotations instead of the expected identity – this is a semantics/contract bug in adjoint logic. ,"It's about high-level gate and meta-operation logic (adjoint rewriting), not build, backend, or runtime environment. ","Incorrect adjoint semantics is an implementation/design problem of the library/compiler logic, not something that can be prevented by analyzing the user code at compile time. "
NVIDIA/cuda-quantum,1175,https://github.com/NVIDIA/cuda-quantum/issues/1175,Tensornet target in Python not registered for async functions ,closed,2024-02-06T15:49:53Z,Backend-/Framework-Integrations-Bug ,Framework-Integration ,C,C,,"When the target is set to tensornet, calling cudaq.sample_async(kernel, 10).get() segfaults in DefaultExecutionManager / runSampling, i.e., the async sampling path is not correctly wired up for the tensornet simulator target.","The error occurs during integration between the Python async API and the C++ layer, which manages various targets. The kernel itself works perfectly.","This is a backend/runtime integration bug that only manifests when executing with the tensornet target and async sampling. Fits class C, because no static property of the kernel usage that compile-time analysis could flag in advance."
NVIDIA/cuda-quantum,1168,https://github.com/NVIDIA/cuda-quantum/issues/1168,JIT compilation fails when inlining is disabled,closed,2024-02-04T12:30:01Z,API-/Usage-/Logic-Bug (High-Level),Framework-Integration ,C,C,,"A legitimate call from one __qpu__ kernel to another only works if a specific inlining pass is active; without it, an inconsistent IR – logic error occurs in the compiler pipeline. ","The bug is located in the MLIR/compiler pass pipeline (call resolution, module structure), i.e., in the interaction between the front end and the compiler/back end. ",Whether an internal pass correctly registers the target function is an implementation detail of the compiler; this cannot be verified by additional checks on the user kernel. 
NVIDIA/cuda-quantum,1159,https://github.com/NVIDIA/cuda-quantum/issues/1159,cmake dependences aren't quite right,open,2024-02-02T00:08:58Z,Build-/Install-/Packaging-Bug,Build/Deploy/Environment ,B ,B ,B1,"Executor links against RestClient, but the CMake/third-party configuration does not build RestClient. this is a build/link/packaging bug. ","The error occurs during building/linking, before any kernel is executed. ",A cleanly modeled build graph/CMake check could determine deterministically during configure/compile that a required target is missing; this is more of a build analysis issue than a runtime problem. 
NVIDIA/cuda-quantum,1136,https://github.com/NVIDIA/cuda-quantum/issues/1136,Tensornet backend scratch space allocator is prone to race condition,open,2024-01-25T01:56:05Z,Performance-/Numerik-Bug ,Backend-Library ,C,C,,The scratch size heuristic uses cudaMemGetInfo and may see incorrect free memory values in multi-tenant or multi-process setups. A resource/numerical/heuristic bug. ,This is a runtime issue in the tensornet backends scratch-space allocation (cudaMemGetInfo to scratchSize to cudaMalloc); concurrent simulator instances can race and overestimate free memory,"Race conditions in cudaMemGetInfo between multiple processes are a runtime/system issue; heuristics can be improved, but they cannot be avoided through user code analysis. "
NVIDIA/cuda-quantum,1117,https://github.com/NVIDIA/cuda-quantum/issues/1117,Intermittent CI llvm-lit test failures for `remote-mqpu` ,closed,2024-01-22T09:41:08Z,Backend-/Framework-Integrations-Bug ,Runtime-/Framework-Runtime ,C,C,,"Multiple remote mqpu tests running in parallel collide when selecting: a coordination/integration problem with the remote runtime, not purely a user configuration error. ","This affects the network/process runtime of the remote target (socket binding, daemon start), i.e., the runtime layer. ","Port collisions caused by parallel processes are typical runtime/env problems; they cannot be prevented by static analysis of Quantum programs, but only by more robust port management logic. "
NVIDIA/cuda-quantum,1108,https://github.com/NVIDIA/cuda-quantum/issues/1108,sample_async race condition,closed,2024-01-18T17:35:49Z,Performance-/Numerik-Bug ,Runtime-/Framework-Runtime ,C,C,,"A very small GHZ circuit triggers a custatevec out of memory error on nvidia-mqpu. A resource/memory management problem, not an API or configuration error on the part of the user. ","The error occurs in the interaction between MQPU runtime, sample_async, and custatevec at runtime, i.e., in the execution/runtime layer. ",How the MQPU runtime allocates memory internally is an implementation detail; this cannot be meaningfully avoided by compile-time analysis of the user code. 
NVIDIA/cuda-quantum,1087,https://github.com/NVIDIA/cuda-quantum/issues/1087,Sporadic test failure in REST platform `get_state_async` test,open,2024-01-12T04:08:39Z,Backend-/Framework-Integrations-Bug ,Runtime-/Framework-Runtime ,C,C,,"The interaction between the REST server, remote MQPU backend, and tests causes hangups in get_state_async so a integration/orchestration problem. ","Asynchrony, scheduling, timeouts, and process interaction. runtime/framework layer. ","Such deadlocks/hangs can only be resolved through better runtime implementation/monitoring, not through compile-time analysis of quantum programs. "
NVIDIA/cuda-quantum,1046,https://github.com/NVIDIA/cuda-quantum/issues/1046,Upgrade pybind11 to the latest version,closed,2023-12-19T17:13:40Z,Backend-/Framework-Integrations-Bug ,Runtime-/Framework-Runtime ,C,C,,Certain versions of pybind11 do not interact correctly with the CUDA-Q Python frontend – Integration/ABI/binding problem. ,"The effect occurs in ongoing tests in the Python binding/call layer, not when building the binaries. ",Compatibility of bindings and binary layout is a runtime/implementation issue; user code analysis does not help here.
NVIDIA/cuda-quantum,1030,https://github.com/NVIDIA/cuda-quantum/issues/1030,Incorrect QIR generated for some conditional measurements (qir_cond_for_loop-6.cpp),closed,2023-12-12T16:47:28Z,API-/Usage-/Logic-Bug (High-Level) ,Framework-Integration ,C,C,,"Correctly written user code leads to logically incorrect QIR/IR (e.g., measurement/result handling in if structures) - Compiler/semantic bug. ","The problem lies in the CUDA-Q compiler pipeline (front end so MLIR/Quake so QIR), i.e., in the integration layer. ",Faulty transformations in compiler passes are classic implementation bugs; compile-time analysis of user code does not help here. 
NVIDIA/cuda-quantum,1022,https://github.com/NVIDIA/cuda-quantum/issues/1022,`from_state` error with `kernel.qalloc()`,closed,2023-12-11T21:15:47Z,API-/Usage-/Logic-Bug (High-Level) ,High-Level-API / Framework-Logic ,A,A,,"Semantically legitimate use (q = kernel.qalloc() and from_state(q, a)); however, the API behaves differently than for qalloc(1) and runs into an error reach of contract/semantics of the high-level API. ","The logic is in the from_state/qubit API itself (single qubit vs. qvector), not in the simulator backend or build. ","The signature/overloads could ensure at compile time that only suitable from_state calls are permitted for kernel.qalloc() or generate a clear error message early on (e.g., more strongly typed qubit/container types). "
NVIDIA/cuda-quantum,928,https://github.com/NVIDIA/cuda-quantum/issues/928,qubit-mapping has bug threading wire values,closed,2023-11-14T23:50:07Z,API-/Usage-/Logic-Bug (High-Level) ,Framework-Integration ,C,C,,"Formally valid user code leads to IR in which linear swap wires are used multiple times, causing the compiler to violate its own linearity rules. ","Errors arise in the interaction between Quake/MLIR passes (e.g., synthesis, qubit mapping, inlining) and the linearity discipline of the IR. ",This is purely a compiler/pass implementation error; it cannot be prevented by type/contract checks on the user side. 
NVIDIA/cuda-quantum,920,https://github.com/NVIDIA/cuda-quantum/issues/920,MPI is not enabled in `cudaq` Python wheels,closed,2023-11-14T02:02:49Z,Build-/Install-/Packaging-Bug,Build/Deploy/Environment ,C,C,,Wheels are delivered without MPI functionality enabled (unlike Docker/native builds)- Seems to be a  packaging/configuration error. ,"It's about build flags and wheel creation, not runtime/compiler logic. ","Such distribution errors can only be addressed by build/release checks, not by type/IR analyses of user code. "
NVIDIA/cuda-quantum,906,https://github.com/NVIDIA/cuda-quantum/issues/906,cudaq.from_state() dosn't work correctly,closed,2023-11-10T22:07:48Z,API-/Usage-/Logic-Bug (High-Level) ,High-Level-API / Framework-Logic ,C,C,,"A valid state vector leads to another, incorrect internal state. the from_state API breaks its guaranteed semantics. ","The error lies in the mapping/representation logic of the high-level state API, not in the backend. ",This is an implementation detail of the framework state representation; user code analysis cannot prevent this. 
NVIDIA/cuda-quantum,875,https://github.com/NVIDIA/cuda-quantum/issues/875,ConvertExpr buildOp currently not specification adherent. ,closed,2023-11-07T18:49:35Z,API-/Usage-/Logic-Bug (High-Level),High-Level-API / Framework-Logic ,C,C,,"The fixup-linkage tool sets incorrect linkage/visibility properties for Mach-O/QIR artifacts, thereby breaking its own contract with the system linker. ","Bug is located in the toolchain/compiler integration layer (QIR/IR to object to host binary), not in the user code or backend. ",Incorrect linkage flags in generated IR are purely tool/implementation errors and cannot be avoided at compile time by analyzing user kernels. 
NVIDIA/cuda-quantum,873,https://github.com/NVIDIA/cuda-quantum/issues/873,Free function kernels won't work on macOS,open,2023-11-07T11:01:34Z,Backend-/Framework-Integrations-Bug ,Framework-Integration ,C,C,,"Chemistry/domain code is incorrectly linked to the QPP simulator (e.g., incorrect backend/precision/state handling) Integration error, not a pure build flag error. ","Layer in which Chemistry Code, CUDA Q-State, and Backend Simulator are wired. ",Such coupling errors are found through testing/CI; they cannot be effectively avoided by analyzing user kernels at compile time. 
NVIDIA/cuda-quantum,867,https://github.com/NVIDIA/cuda-quantum/issues/867,Allow for more complex builder gate signatures in library mode,closed,2023-11-06T21:16:18Z,Backend-/Framework-Integrations-Bug ,Framework-Integration ,C,C,,"QPP complains because CUDA-Q passes the subsystems/indexes to applyCTRL in such a way that dimension contracts are violated. This is an integration problem, not a QPP bug. ","Bug at the interface between CUDA-Q-State/register representation and QPP API (subsystem division, endianness/order). ",Whether this internal translation is correct depends solely on the library implementation; user code analysis cannot prevent this. 
NVIDIA/cuda-quantum,866,https://github.com/NVIDIA/cuda-quantum/issues/866,Unable to use IQM QPU machine name with spaces,closed,2023-11-06T12:38:06Z,Backend-/Framework-Integrations-Bug ,Framework-Integration ,C,C,,"The problem lies in the interaction between nvq++-CLI, IQM backend, and runtime: the machine string option passed with spaces iis interpreted incorrectly, resulting in an architecture mismatch exception at runtime, even though the user specifies the correct architecture. ","This affects the integration layer between the CUDA-Q toolchain/runtime and the external IQM-REST/QPU backend (parsing & mapping of the --iqm-machine option), not the pure build environment or a single backend library. ","This is an implementation error in the handling/transfer of machine names (e.g., splitting at spaces or incorrect comparison); additional compile-time analyses of the user code or stronger typing of the Quantum programs would not prevent this. A fix is needed in the CLI/runtime implementation itself. "
NVIDIA/cuda-quantum,819,https://github.com/NVIDIA/cuda-quantum/issues/819,from_state prepares incorrect state,closed,2023-10-24T03:55:43Z,API-/Usage-/Logic-Bug (High-Level) ,High-Level-API / Framework-Logic ,C,C,,"cudaq.from_state(statevector) prepares the wrong computational basis state for 3+ qubits (e.g., an input statevector for |111? samples as |110?), even though it appears correct for up to 2 qubits. ","The defect is in the from_state state-preparation routine in the high-level API (how it maps the provided statevector into internal initialization logic / qubit ordering), not in user code syntax or build configuration.",This is a library semantic correctness bug in state initialization; it requires fixing the from_state implementation and cannot be prevented by generic compile-time or user-side static checks. 
NVIDIA/cuda-quantum,814,https://github.com/NVIDIA/cuda-quantum/issues/814,Ternary operator not working in `__qpu__` kernels,closed,2023-10-23T20:08:17Z,API-/Usage-/Logic-Bug (High-Level) ,Backend-Library ,B ,B ,B2,"The nvq++ compiler is generating IR that always executes the instructions involved in ternary operations. It should generate conditional IR instead. That is - for the a ? b : c expression, it should evaluate a, and then based on the result of a, it should then evaluate b OR c, not both.",The defect lies in the CUDA-Q C++ frontend / Quake IR lowering for ternary (?:) operators inside kernels: the generated IR encodes the wrong control-flow semantics before any backend simulator or environment is involved,A specialised IR verifier or compiler test generator could detect that a supposed conditional expression has both branches evaluated and merged which requires analysis of the generated control flow rather than simple local type/contract checks
NVIDIA/cuda-quantum,810,https://github.com/NVIDIA/cuda-quantum/issues/810,Logical `&&` operator not working in `__qpu__` kernels,closed,2023-10-23T12:35:57Z,API-/Usage-/Logic-Bug (High-Level) ,Framework-Integration ,C,C,,A kernel that works with a logical && is translated in IR with incorrect short-circuit/branch logic. The compiler violates the semantics of the high-level language. ,"The error lies in IR generation/optimization (front end ? Quake/MLIR ? target IR), i.e., in the compiler/framework integration layer. ","Incorrectly generated branch/logical IR is a typical pass/compiler bug; it cannot be avoided by analyzing the user kernels at compile time, but only by fixing/verifying the transformations. "
NVIDIA/cuda-quantum,806,https://github.com/NVIDIA/cuda-quantum/issues/806,[QIR] Lowering ctrl-swap not implemented,closed,2023-10-20T19:29:49Z,API-/Usage-/Logic-Bug (High-Level) ,Framework-Integration ,C,C,,"The lowering code for two-target operations contains a hard error message for controlled variants, i.e., certain valid operations are simply not supported. A logic/feature gap in the compiler. ","The bug lies in the LowerToQIR/Pass code (Quake/MLIR ? QIR), i.e., in the compiler/framework integration layer. ",The fact that a certain operation is not implemented in lowering is purely an implementation issue; additional compile-time analysis of the user code cannot remedy this. 
NVIDIA/cuda-quantum,805,https://github.com/NVIDIA/cuda-quantum/issues/805,[QIR] Bug in lowering multi-ctrl to LLVM,closed,2023-10-20T18:58:06Z,Backend-/Framework-Integrations-Bug ,Framework-Integration ,C,C,,"Lowering a multi-controlled operation (via cudaq::control(...) / x<cudaq::ctrl>) produces incorrect behavior: when the Quake is lowered to LLVM/QIR, executing the program yields a wrong value for the first control qubit in the multi-control invocation","The bug is in the compiler lowering pipeline from Quake/MLIR to LLVM/QIR-specifically how multi-control is represented and passed to the QIR helper (invokeWithControlQubits) / controlled QIS calls during LLVM generation, not in user code or runtime environment",This is a semantic correctness defect in the compiler's QIR/LLVM lowering for multi-control; it requires fixing the lowering/codegen implementation and cannot be prevented by generic user-side compile-time checks or type validation.
NVIDIA/cuda-quantum,799,https://github.com/NVIDIA/cuda-quantum/issues/799,Issue with generated thunk for kernel with cc.callable argument,open,2023-10-19T20:17:13Z,API-/Usage-/Logic-Bug (High-Level) ,Framework-Integration ,C,C,,The generated IR calls via a cc.undef function pointer instead of a correctly set pointer. Llogic bug in the compiler chain. ,"The error occurs in the IR/Codegen integration (front end ? Quake/MLIR ? LLVM/QIR), i.e., in the compiler/framework layer. ",Incorrectly initialized function pointers in the generated IR are an internal compiler problem; this cannot be avoided by user code analysis at compile time. 
NVIDIA/cuda-quantum,776,https://github.com/NVIDIA/cuda-quantum/issues/776,Broadcasting on observe yields incorrect results ,closed,2023-10-16T12:35:16Z,API-/Usage-/Logic-Bug (High-Level) ,High-Level-API / Framework-Logic ,C,C,,"For batched parameters (3�2 theta_vals), observe returns a list of the wrong length (and types), i.e., the high-level API does not adhere to its return contract for batched inputs. ","The error lies in the observe/batching logic of the Python frontend, not in the backend or in the build. ",This is an implementation error in the result aggregation; additional compile-time analyses of the user code do not change this; a fix in the framework is required. 
NVIDIA/cuda-quantum,759,https://github.com/NVIDIA/cuda-quantum/issues/759,Hamiltonian list does not work with observe_async,open,2023-10-11T15:44:08Z,API-/Usage-/Logic-Bug (High-Level) ,High-Level-API / Framework-Logic ,A,A,,"observe_async only supports a single SpinOperator, but breaks down with a list, even though observe works with a list. So inconsistent API/contract logic. ","This only affects the Python frontend or the high-level API signatures of observe vs. observe_async, not the backend. ","With stricter type/overload contracts (e.g., different function names or statically typed parameters), you could enforce at compile time that observe_async only accepts the allowed argument type or generates a clear error early on. "
NVIDIA/cuda-quantum,677,https://github.com/NVIDIA/cuda-quantum/issues/677,[Bug] Cross dependence between regression and unit tests,open,2023-09-20T21:04:00Z,Build-/Install-/Packaging-Bug,Build/Deploy/Environment ,C,C,,"A Quake regression test depends on IonQ-specific environment/tests, resulting in fragile, environment-dependent test runs. Configuration design problem. ","It's about test/build infrastructure and its dependencies, not runtime or compiler logic. ","Such cross-dependencies in tests are organizational/infrastructure problems; they cannot be prevented by analyzing user kernels, but only by improving test structuring."
NVIDIA/cuda-quantum,640,https://github.com/NVIDIA/cuda-quantum/issues/640,Async execution in Python is broken,closed,2023-09-11T13:28:34Z,Backend-/Framework-Integrations-Bug ,Runtime-/Framework-Runtime ,C ,C ,,Asynchronous execution uses Python objects in C++ threads without proper GIL handling. Integration problem between Python runtime and C++ async execution. ,"The bug lies in runtime behavior (threads, GIL, async executor), not in compilation or pure backend implementation. ",Race/threading/GIL issues are runtime/implementation details; they cannot be reliably prevented by static analysis of Quantum user code at compile time. 
NVIDIA/cuda-quantum,637,https://github.com/NVIDIA/cuda-quantum/issues/637,Nightly integration test failures for 4 IonQ tests (empty programs),closed,2023-09-10T20:41:53Z,Backend-/Framework-Integrations-Bug ,Framework-Integration ,B ,B ,B2,"Combining several changes completely optimizes the program away, and the IonQ backend call fails on an empty program. Problem in the interaction between the optimizer and backend requirements. ","The error lies in the compiler/framework layer, which optimizes IR in such a way that virtually no useful code remains for the IonQ backend. ","A robust optimizer/IR validator could detect before submission that the program is completely empty and issue a warning or error, but this requires additional, non-trivial analysis. "
NVIDIA/cuda-quantum,630,https://github.com/NVIDIA/cuda-quantum/issues/630,Python formatting of tests not enforced in CI,closed,2023-09-08T19:38:11Z,Build-/Install-/Packaging-Bug,Build/Deploy/Environment ,C,C,,The CI job for Python formatting is configured so that it does not fail when problems occur and thus does not block violations. An error in build/test configuration. ,"Only affects the CI/build layer (yapf check, exit codes) before anything is compiled or executed. ",This is a configuration/script problem with the CI; compile-time analysis of user code has no effect here; a correct pipeline/job configuration is required. 
NVIDIA/cuda-quantum,609,https://github.com/NVIDIA/cuda-quantum/issues/609,crash in test_runtime_dm,closed,2023-09-06T16:09:04Z,Performance-/Numerik-Bug ,Runtime-/Framework-Runtime ,C,C,,"The Density Matrix Runtime Test returns statistically inconsistent results or fails unexpectedly-this is an error in the algorithmic implementation, not in the API usage. ","The error occurs when executing the runtime/simulator logic (unit tests running, binary starting), not during the build or in the high-level frontend. ","Numerical/runtime bugs in the internal DM implementation cannot realistically be prevented by analyzing the user code at compile time, but only by fixes and tests in the runtime code. "
NVIDIA/cuda-quantum,603,https://github.com/NVIDIA/cuda-quantum/issues/603,Kernel is translated into an invalid QASM,closed,2023-09-05T18:17:38Z,Backend-/Framework-Integrations-Bug ,Framework-Integration ,C,C,,The translator generates QASM with gate names that start with _ (QASM 2.0 incompatible) and with gate definitions that come after their use; this is where the integration between cudaq/Quake-IR and the OpenQASM format fails. ,"It's about the layer where internal kernel MLIR is translated in OpenQASM ""for external consumers"" (QASM backends) a  format/backend integration task, not purely internal high-level API semantics. ","The fact that the generated QASM text violates the specification could be detected by additional QASM linting steps, but these are checks on the generator code, not on the user kernel; in terms of your CTClass definition (analysis of user/kernel code), this is an implementation problem in the translator and thus C. "
NVIDIA/cuda-quantum,583,https://github.com/NVIDIA/cuda-quantum/issues/583,cuda-quantum docker cpu have different result with gpu,closed,2023-08-29T06:19:25Z,Performance-/Numerik-Bug ,Backend-Library ,C,C,,"Without set_target('nvidia'), the VQE run delivers physically plausible energies and a non-trivial state vector, whereas with GPU target it always delivers the same incorrect value and a practically zero state. �� this is a numerical correctness error in the GPU path, not purely an API or config problem. ","The problem only occurs in the nvidia target, i.e., in the GPU backend implementation (cuStateVec/cuTensorNet or their connection); the same high-level code works with the default backend. ","Whether the GPU backend core calculates correctly depends on internal numerical code, FP paths, and, if applicable, hardware details; a static check of user kernels or API contracts cannot prevent a specific backend path from always producing the same incorrect energy and a zero state. "
