<,IssueID,URL,Title,Status,CreatedAt,BugType ,StackLayer,,CTClass,subtype,reason Bug,reason Stack,reason Class
NVIDIA/cuda-quantum,3433,https://github.com/NVIDIA/cuda-quantum/issues/3433,Can not pip install cudaq on Ubuntu 22.04,open,2025-09-10T22:11:20Z,Build-/Install-/Packaging-Bug,Build/Deploy/Environment ,B ,B ,B1,The PyPI cudaq source distributions are published with broken package metadata where the project name is reported as unknown ,The problem lives in the build pipeline for Python (pyproject),A packaging linter or CI step that validates the built Wheel metadata could detect this mismatch deterministically before Publishing. Fits  B1
NVIDIA/cuda-quantum,2937,https://github.com/NVIDIA/cuda-quantum/issues/2937,Wrong simulation result with the tensornet/tensornet-mps target,closed,2025-05-21T06:22:52Z,Performance-/Numerik-Bug ,Backend-Library ,C,C,,"For this specific highly structured 20-qubit circuit, the tensornet and tensornet-mps targets return a sample distribution that only contains 8 bitstrings instead of the 16 bitstrings ",The issue is confined to the tensor-network simulation backend. It is located in the Cuda-Q backend library. ,It is a numerical or algorithmic error in the backend logic. Therefore it cannot be detected at compile time.
NVIDIA/cuda-quantum,2641,https://github.com/NVIDIA/cuda-quantum/issues/2641,Testing regression introduced with python/tests/kernel/test_explicit_measurements.py,closed,2025-02-20T18:10:53Z,Build-/Install-/Packaging-Bug,Build/Deploy/Environment,B ,B ,B1,A change introduced in PR #2567 broke the Python test python/tests/kernel/test_explicit_measurements.py,The problem is the test harness and its target discovery logic that are incorrect for partial builds. Cuda-Q Kernel seem fine,"This is a configuration problem, which could be solved with a configuration check. Skipping the config could help. Fits B1 "
NVIDIA/cuda-quantum,2628,https://github.com/NVIDIA/cuda-quantum/issues/2628,using cudaq.State and mqpu backend to run two independent circuit gives error,open,2025-02-17T20:35:00Z,Backend-/Framework-Integrations-Bug,Runtime-/Framework-Runtime ,C,C,,"When the user prepares two cudaq.State objects from CuPy data and runs the same kernel on the nvidia target with option=""mqpu"" using sample_async on qpu_id=0 and qpu_id=1, the program aborts with ubackend::RuntimeError: cudaErrorIllegalAddress",The issue is rooted in the CUDA-Q backend. This points to abug in backend library. ,Illegal device address at runtime is low level memory management. 
NVIDIA/cuda-quantum,2627,https://github.com/NVIDIA/cuda-quantum/issues/2627,List of list in kernel argument gives error,open,2025-02-17T16:38:51Z,API-/Usage-/Logic-Bug (High-Level) ,High-Level-API / Framework-Logic ,A,A,,"When the kernel is declared with a nested Python type annotation and called with a list-of-lists argument, CUDA-Q fails at runtime with RuntimeError","The problem resides in the high-level Python language binding and its type-mapping layer. Kernel call uses  Python syntax, but Cuda-Q does not support this.",We could use a expressive static type checker for rejecting unsupported nested container types. This could be done at compile time.
NVIDIA/cuda-quantum,2625,https://github.com/NVIDIA/cuda-quantum/issues/2625,[Python][MLIR?] Loop miscompilation,closed,2025-02-17T15:45:17Z,API-/Usage-/Logic-Bug (High-Level) ,Backend-Library ,B ,B ,B2,Compiling the bar kernel crashes with an LLVM/MLIR assertion. ,The problem is in the Cuda-Q compiler / MLIR backend. ,"A robust IR verifier running after control flow transformation could detected that mlir::value with no attached result is being treated as an OpResult. This requieres IR level validation. Not simple compile time check, so B2"
NVIDIA/cuda-quantum,2608,https://github.com/NVIDIA/cuda-quantum/issues/2608,The bridge failing to deal with captured globals.,open,2025-02-11T12:18:59Z,API-/Usage-/Logic-Bug (High-Level),Framework-Integration,B ,B ,B2,The Python Q bridge records it in the symbol table as !cc.ptr<f64> instead of plain f64,The problem lies in the framework integration layer. ,Could possibly be resolved with data flow manager with capturied symbols to verify statically the globals used as scalar parameters. Fits B2 
NVIDIA/cuda-quantum,2600,https://github.com/NVIDIA/cuda-quantum/issues/2600,Return list[complex] fails when returning list[float],closed,2025-02-07T15:17:46Z,API-/Usage-/Logic-Bug (High-Level) ,High-Level-API / Framework-Logic ,A,A,,error: type of return operand 0 ('!cc.stdvec<f64>') doesn't match function result type ('!cc.stdvec<complex<f64>>') in function @__nvqpp__mlirgen__myop,"Usere code is syntactivally valid, but the bridge does not reconcile the list annoation with a float-valued list literal.", more advanced static type checker could be used for the front-end. It could detect return expression has ceratin type. Match this class A
NVIDIA/cuda-quantum,2593,https://github.com/NVIDIA/cuda-quantum/issues/2593,cannot use @cudaq.kernel in the interpreter: OSError: could not get source code,open,2025-02-06T16:42:27Z,API-/Usage-/Logic-Bug (High-Level),High-Level-API / Framework-Logic ,C,C,,"When the user types the @cudaq.kernel example from the official VQE tutorial directly into an interactive Python interpreter, the decorator fails",The failure occurs entirely in the high-level Python API. No backend simulation or procedure is involved.,Bug seems to be limited at at specific interpreter environment and is bound to Python semantics. How to rule out this at compile time? Class C
NVIDIA/cuda-quantum,2575,https://github.com/NVIDIA/cuda-quantum/issues/2575,custom gate register_operation doesn't seem to work if it is invoked in one kernel which is nested in another.,open,2025-02-02T19:37:34Z,API-/Usage-/Logic-Bug (High-Level) ,Framework-Integration ,C,C,,"A custom matrix gate registered via cudaq.register_operation(""my_gate"", my_matrix) can be called in a kernel, but calling it through a nested kernel is ignored",It seems like the problem is in the Python Framework integration that connects custom registered operations into kernel call graphs.,"Hard to impossible to validate, because detecting requieres reasoning which is not simply checked at compile time. Fits C "
NVIDIA/cuda-quantum,2560,https://github.com/NVIDIA/cuda-quantum/issues/2560,Input argument to a kernel throws an error,open,2025-01-30T16:21:31Z,API-/Usage-/Logic-Bug (High-Level),High-Level-API / Framework-Logic ,A,A,,"A kernel with def kernel(list) cannot be called with a = [(1,2)]. The Python bridge raises an error while trying to interpret the list. ",Parses annotations and builds python to Q type mapping. Seems to be high level Python API to framework mapping problem.,A stronger static checker for the Python fron-end could detect that list of touples is an unsupported operation. Fits A
NVIDIA/cuda-quantum,2550,https://github.com/NVIDIA/cuda-quantum/issues/2550,[Python] Noise channels don't respect single/double precision setting of the target,closed,2025-01-28T00:33:22Z,Performance-/Numerik-Bug,Backend-Library,C,C,,"In NoiseModel.h, kraus_op data is templated (cudaq::complex). However, when generating Python binding (py_NoiseModel.cpp), this is compiled only with double precision config. This caused bogus Kraus channel data for single-precision targets, e.g., when the channel is created in Python with cudaq.KrausChannel",It is a backend library config problem for the Python binings. Model templates and their Python exposure seem to be inconsistent.,Needs verification that c or cpp File is built for both float and double. Underlying issue is numeric implementation error.
NVIDIA/cuda-quantum,2541,https://github.com/NVIDIA/cuda-quantum/issues/2541,Python ast bridge and kernel builder do not properly annotate kernels,closed,2025-01-24T21:20:06Z,Backend-/Framework-Integrations-Bug ,Framework-Integration ,B ,B ,B2, A kernel function must be annotated with the cudaq-kernel attribute. Python doesn't do this making proper identification of kernel functions impossible,"Python front end generates Q-IR, bridge omits the kernel annotation in the produced metadata, independent of backend simulator or environment.",metadata validator could check any callable exposed as Cuda-Q kernel carries the cudaq-kernel attribute and flag missing annotations before compilation. Would requiere lots of effort with metadata checks. 
NVIDIA/cuda-quantum,2540,https://github.com/NVIDIA/cuda-quantum/issues/2540,Python AST Builder assigns quantum memory artifacts to classic memory locations,closed,2025-01-24T21:10:55Z,API-/Usage-/Logic-Bug (High-Level),Backend-Library,B ,B ,B2,"Lowering generates a pattern that copies quantum references into a classical array, which is prohibited according to IR semantics.","Backend library: The problem lies in the code generator/optimizer passes for Quake/CC-IR, not in the user frontend.","(potentially avoidable at compile time, advanced analysis): An IR verifier could prohibit quake.ref from being stored in classic data structures (local pattern, but special check required)."
NVIDIA/cuda-quantum,2538,https://github.com/NVIDIA/cuda-quantum/issues/2538,Python kernel builder uses empty strings for measurement names,closed,2025-01-24T20:04:52Z,API-/Usage-/Logic-Bug (High-Level),High-Level-API / Framework-Logic,A,A,,"Python kernel builder generates measurement operations with empty names, even though this is defined as illegal in the IR.","The error is in the high-level builder, which generates invalid IR.",A simple local check “Name must not be empty” in the Builder or IR Verifier would deterministically prevent this pattern.
NVIDIA/cuda-quantum,2536,https://github.com/NVIDIA/cuda-quantum/issues/2536,Compile error when using `cudaq::adjoint` on quantum kernels with non-trivial `for` loop conditions,open,2025-01-24T14:47:30Z,API-/Usage-/Logic-Bug (High-Level),Backend-Library,C,C,,"From the user's point of view, correct loops (e.g., i < size-1 or while (i < size)) cannot be adjusted and lead to compiler errors.","The problem stems from the MLIR/CFG/adjoint passes in the compiler, not from the environment or backend selection.",The lack of support for certain control flow forms in the adjoint pipeline is a compiler implementation problem that cannot be avoided by additional checks on the user code.
NVIDIA/cuda-quantum,2525,https://github.com/NVIDIA/cuda-quantum/issues/2525,cudaq.control() doesn't work with exp_pauli(),closed,2025-01-21T17:57:24Z,Performance-/Numerik-Bug ,Backend-Library ,C,C,,"The circuit perform the exp_pauli() on both the |0> and the |1> subspaces on the state. If I instead, perform a cudaq.control() with a different gate, say Ry(), I get the correct result. ",The problem resides in the backend library’s implementation of exp_pauli and its interaction with cudaq.control for controlled multi-qubit exponentials,This is a semantic error in the backend’s numerical logic for controlled exp_pauli. It cannot be ruled out by generic compile-time or static type checks and requires runtime validation
NVIDIA/cuda-quantum,2457,https://github.com/NVIDIA/cuda-quantum/issues/2457,`mx` operation unsupported in OpenQASM conversion,closed,2024-12-09T19:27:09Z,Backend-/Framework-Integrations-Bug,Framework-Integration,C,C,,"Currently, a CUDA-Q kernel containing the mx measurement operation cannot be translated into OpenQASM 2.0 via cudaq.translate()",Possible error in integration btw Cuda-Qs Quake IR and the OpenQASM 2 backend.,a static checker couldn't generally know which operations a given translation backend supports
NVIDIA/cuda-quantum,2453,https://github.com/NVIDIA/cuda-quantum/issues/2453,Float comparison operator throws throws error in cudaq.kernel,closed,2024-12-05T21:43:47Z,API-/Usage-/Logic-Bug (High-Level),Backend-Library,B ,B ,B2,"Attempting to use comparison operators like < throws an error in a cudaq.kernel. Used kernel is a = 0.5 < 1.0. This will throw: error: 'arith.cmpi' op operand #0 must be signless-integer-like, but got 'f64' ","the high-level kernel code is valid Python, but the bridge emits an arith.cmpi op with the wrong type constraints ",A IR validator or operator-compatibility check could statically flag that float operands are being fed to an integer-only compare op 
NVIDIA/cuda-quantum,2452,https://github.com/NVIDIA/cuda-quantum/issues/2452,Error not thrown when broadcasting custom unitary to a qvector.,open,2024-12-05T19:24:02Z,API-/Usage-/Logic-Bug (High-Level) ,High-Level-API / Framework-Logic,A,A,,"When attempting to broadcast a custom unitary to a qvector, an error is not thrown. In the reproducer below, the kernel produces an incorrect result when sampled. ",The issue is in the high-level Python API / kernel-call that wires cudaq.qvector arguments into registered custom operations ,A front-end checker could statically compare the arity implied by the custom-op matrix with the argument shape 
NVIDIA/cuda-quantum,2434,https://github.com/NVIDIA/cuda-quantum/issues/2434,cudaErrorIllegalAddress error when using exp_pauli(...) on multiple GPUs,open,2024-11-28T15:14:43Z,Performance-/Numerik-Bug,Backend-Library,C,C,,"When using exp_pauli(pauli string) in a kernel, cudaq.observe(...) and cudaq.sample(...) calls result in the error:  RuntimeError: cudaErrorIllegalAddress ",Error arises in the CUDA-Q backend library that implements multi-GPU execution of exp_pauli. ,Illegal address on the GPU is a low-level runtime bug. Nothing which could be detected reasonably within compiletime
NVIDIA/cuda-quantum,2425,https://github.com/NVIDIA/cuda-quantum/issues/2425,[braket] Reorder global register to be in original qubit allocation order,open,2024-11-27T01:25:48Z,Backend-/Framework-Integrations-Bug,Framework-Integration,C,C,,"Reorder global register to be in original qubit allocation order for braket backend, if we run any qubit mapping. ",A framework integration issue in the Braket backend’s mapping layer. Cuda-Q kernel and API seem to be fine.  ,Whether a backend reorders qubits after mapping is a backend-specific integration detail. A generic compile-time checker on user code cannot easily see or forbid this.
NVIDIA/cuda-quantum,2415,https://github.com/NVIDIA/cuda-quantum/issues/2415,Failure when building `OptTransforms` library alone.,closed,2024-11-25T19:12:49Z,Build-/Install-/Packaging-Bug,Build/Deploy/Environment,B ,B ,B1,Partial build of OptTransforms does not generate missing headers and fails during compilation.,"This is a build-system / CMake dependency-graph issue for generated headers in the OptTransforms/Optimizer CodeGen pipeline (e.g., missing generation of Passes.h.inc when building OptTransforms in isolation), not an exp_pauli / cudaq.control backend-library problem. ","(potentially avoidable at compile time, advanced analysis): A build system check could specifically verify whether all generated includes are correctly created as dependencies."
NVIDIA/cuda-quantum,2306,https://github.com/NVIDIA/cuda-quantum/issues/2306,Unified memory support on GH200 Grace Hopper,closed,2024-10-21T16:49:29Z,Performance-/Numerik-Bug ,Backend-Library,C,C,,"Simulation fails with ""requested size is too big,"" even though hardware with unified memory should actually allow for more qubits.","Limitations arise from cuQuantum/backend memory allocation (e.g., cudaMalloc vs. cudaMallocManaged), not from user code or build.",The use of unified memory is an implementation/architecture issue on the backend that cannot be “avoided” by user-side compile-time checks.
NVIDIA/cuda-quantum,2279,https://github.com/NVIDIA/cuda-quantum/issues/2279,Inconsistent behavior with mid-circuit measurements while sampling if NO reset is performed after the measurement,open,2024-10-14T22:58:54Z,Performance-/Numerik-Bug,Backend-Library,C,C,,Semantically identical kernels produce different __global__ distributions because mid-circuit measures do not collapse the state.,"The cause lies in the implementation of the simulators (except for stim), which incorrectly model mid-circuit measurements.",This is a fundamental question of simulation semantics and can only be resolved by changing the simulator implementations.
NVIDIA/cuda-quantum,2274,https://github.com/NVIDIA/cuda-quantum/issues/2274,Erroneous mid-circuit measurements while sampling if a reset is performed after the measurement,closed,2024-10-14T15:30:10Z,Performance-/Numerik-Bug,Backend-Library,C,C,,Mid-circuit measurements are being reported with incorrect values if a reset follows them. I believe this affects all of the existing simulators. ,The problem sits in the simulator backend. the reset implementation does not flush pending sampling tasks ,Whether the simulator correctly flushes its internal sampling queue on reset is purely a runtime implementation detail 
NVIDIA/cuda-quantum,2271,https://github.com/NVIDIA/cuda-quantum/issues/2271,Mid-circuit measurements are not handled properly when using `__qpu__` attributes on C++ functions or lambdas,open,2024-10-14T00:40:22Z,Backend-/Framework-Integrations-Bug,Framework-Integration,C,C,,"Runtime cannot resolve function names from __qpu__ kernels, so mid-circuit conditionals are handled incorrectly.","Problem lies in runtime/integration: Kernel names of __qpu__ functions/lambdas are not resolved at runtime; as a result, conditional feedback is not recognized (kernelHasConditionalFeedback ? false).",Whether kernel names end up correctly in the runtime metadata map is an internal integration issue and cannot be avoided by static analysis of the user code.
NVIDIA/cuda-quantum,2249,https://github.com/NVIDIA/cuda-quantum/issues/2249,anyon target is not stable in CI,closed,2024-10-03T20:05:12Z,Performance-/Numerik-Bug,Backend-Library,C,C,,The anyon target is not stable in CI: target tests fail when anyon is selected and stdout is empty/incorrect. ,"The problem is in the anyon target implementation and its CI/target-test execution path, not in simulator reset/sampling semantics. ",This is an internal target/backend stability issue; user-side compile-time checks cannot prevent CI-time target instability.
NVIDIA/cuda-quantum,2240,https://github.com/NVIDIA/cuda-quantum/issues/2240,List defined inside a kernel passed into subkernel throws an error,open,2024-10-01T12:25:32Z,API-/Usage-/Logic-Bug (High-Level),High-Level-API / Framework-Logic ,C,C,,"A list created inside a kernel and then passed into a subkernel causes a compilation failure (call operand type mismatch / list lowering issue), while passing a list literal directly works. "," Problem in the interaction between high-level kernel/draw API and backend/library call, not in the user kernel itself.",The error lies in the specific implementation of the draw/backend path and cannot be prevented by additional static checks on the user code.
NVIDIA/cuda-quantum,2196,https://github.com/NVIDIA/cuda-quantum/issues/2196,FuseWithConstantArray on ExtractValueOp always returns success(),closed,2024-09-06T16:20:11Z,API-/Usage-/Logic-Bug (High-Level),Backend-Library,B ,B ,B2,"The MLIR pass returns ""success"" even though no pattern was applied, thereby blocking further canonicalization patterns.","The bug is in the compiler/optimizer pass of Quake/CC-IR, not in the user API or environment.","An IR/pass validator could statically find the inconsistency “success without change”; however, this requires special compiler analyses, not just simple type checks."
NVIDIA/cuda-quantum,2185,https://github.com/NVIDIA/cuda-quantum/issues/2185,`nvidia` target: simulation errors when setting `CUDAQ_MAX_CPU_MEMORY_GB` beyond system memory capacity,open,2024-09-02T04:18:07Z,Config-/Environment-Bug,Runtime-/Framework-Runtime ,C,C,,"Documented environment variable does not behave robustly for ""unlimited"" or too large values and leads to runtime errors / incorrect results.","The error lies in the runtime logic of how the simulators interpret host/GPU memory limits, not in the build or user API.",The relationship between physical memory and runtime configuration cannot be detected by analyzing the user code; a more robust runtime implementation is required.
NVIDIA/cuda-quantum,2157,https://github.com/NVIDIA/cuda-quantum/issues/2157,Drawing conditional measurement operations,open,2024-08-27T09:28:43Z,API-/Usage-/Logic-Bug (High-Level),High-Level-API / Framework-Logic ,C,C,,"The drawing function ignores conditional gates based on measurement results, thereby violating the expected visualization semantics.","The error lies in the high-level display/visualization logic, regardless of the backend and numerics.","The problem is a lack of functionality in the Draw API; compile-time checks on the kernel code cannot “prevent” this, only the implementation itself can fix it."
NVIDIA/cuda-quantum,2110,https://github.com/NVIDIA/cuda-quantum/issues/2110,C++ segfault when passing callable kernel to another kernel from library,open,2024-08-19T23:22:46Z,Backend-/Framework-Integrations-Bug,Framework-Integration,C,C,,"Passing a callable quantum kernel across translation units (library-defined kernel wrapped as std::function and invoked from another kernel) triggers a C++-side segfault in CUDA-Q, despite being valid C++ usage.","The problem is in the toolchain/runtime's handling of kernel symbol identity and callable kernel plumbing across translation units / function objects, not in the user algorithm.",This is a runtime/toolchain integration limitation; generic compile-time checks on user code cannot reliably prevent it without overly restricting valid C++ patterns (Class C).
NVIDIA/cuda-quantum,2092,https://github.com/NVIDIA/cuda-quantum/issues/2092,Incorrect spin op expression evaluation,closed,2024-08-14T20:18:13Z,Performance-/Numerik-Bug,Backend-Library,C,C,,Evaluating certain spin operator expressions produces an incorrect matrix (order-dependent: one ordering yields wrong results while the reversed ordering is correct).,The defect lies in the backend library's spin-operator algebra / matrix construction logic (implementation bug in operator composition).,This is a semantic/algebraic backend bug that requires fixing library logic; it cannot be eliminated by static checks on user code.
NVIDIA/cuda-quantum,2088,https://github.com/NVIDIA/cuda-quantum/issues/2088,Target tests appear to sometimes use files from installation directory,closed,2024-08-13T17:04:14Z,Build-/Install-/Packaging-Bug,Build/Deploy/Environment,B ,B ,B1,"Target tests sometimes pick up artifacts from a prior make install instead of the current build, making tests non-deterministic and not actually validating the build under test.","The root cause is in CMake/test configuration and path resolution (e.g., install vs build directory precedence, search paths/RPATH), not in runtime execution.","A build/test validation step can deterministically detect this (e.g., assert tests reference build-tree artifacts), so it is preventable via pre-run configuration checks (Class B1)."
NVIDIA/cuda-quantum,2076,https://github.com/NVIDIA/cuda-quantum/issues/2076,`qvector` initialization from state does not work unless no other qubits have been allocated yet,closed,2024-08-12T13:13:51Z,Performance-/Numerik-Bug,Backend-Library,C,C,,"Initialization of q = cudaq.qvector(vec) unexpectedly affects the upstream qubit p, resulting in an incorrect measurement distribution.","Error in the implementation of the state-init routines of the nvidia-* backends, not in API usage or build.",The correctness of state preparation is purely backend algorithmics and cannot be verified in practice by type/contract checks on the user kernel.
NVIDIA/cuda-quantum,1975,https://github.com/NVIDIA/cuda-quantum/issues/1975,Synthesis fails for some kernels that use `cudaq::slice_vector`,closed,2024-07-19T20:59:04Z,API-/Usage-/Logic-Bug (High-Level),Framework-Integration,C,C,,Using slice_vector/observe generates IR that is not supported by the synthesizer/NVQC path.,Bug in the interaction between the CUDA-Q front end (pointer/slice API) and the downstream synthesis/NVQC infrastructure.,"This is a gap/compatibility issue in the synthesizer. additional analysis of the user code would not prevent it, but would only generate earlier error messages."
NVIDIA/cuda-quantum,1957,https://github.com/NVIDIA/cuda-quantum/issues/1957,[MLIR mode] Compile error for `pauli_word` argument,closed,2024-07-18T05:53:38Z,API-/Usage-/Logic-Bug (High-Level),High-Level-API / Framework-Logic ,C,C,,"In MLIR mode, compiling a kernel that takes a cudaq::pauli_word and passes it to exp_pauli(theta, q, pauli) fails with error: could not determine string argument",Issue is probably in the compiler and not API misuse or backend simulation.,Would need a type validator for the MLIR path. Advanced knowledge and implementation in combination with specialised compiler-level analysis instead of some kind of type checking
NVIDIA/cuda-quantum,1946,https://github.com/NVIDIA/cuda-quantum/issues/1946,current version of cudaq.draw throws error if kernel uses exp_pauli,closed,2024-07-17T16:47:33Z,Backend-/Framework-Integrations-Bug,Framework-Integration,C,C,,"cudaq.draw() fails for kernels that include exp_pauli(...): the visualization path triggers an initialization / simulator setup error, even though the same kernel can execute normally (e.g., via sample()/observe())","The fault is in the draw/visualization pipeline and its integration with the backend (e.g., the custatevec-based path used by draw()), not in the user kernel semantics. It is an interaction bug between the front-end drawing code and the backend initialization logic.",This is a draw/visualization-path backend initialization bug (custatevec applyExpPauli fails in cudaq.draw while execution via sample() works) and cannot be prevented by user-side compile-time checks 
